{
    "$schema": "http://json-schema.org/draft-07/schema#",
    "title": "L-Py",
    "type": "object",
    "required": [
        "schema",
        "version"
    ],
    "properties": {
        "schema": {
            "enum": ["lpy"]
        },
        "version": {
            "type": "string"
        },
        "options": {
            "$ref": "options.json"
        },
        "parameters": {
            "type": "array",
            "items": {
                "$ref": "category.json"
            }
        },
        "materials": {
            "type": "array",
            "items": {
                "$ref": "appearance.json"
            }
        },
        "credits" : {
            "$ref": "credits.json"            
        }
    }
}
