{
    "schema": "lpy",
    "version": "1.1",
    "options": {
        "compilation": {},
        "matching": {},
        "processing": {},
        "interaction": {}
    },
    "parameters": [
        {
            "name": "Panel 1",
            "enabled": true,
            "scalars": [],
            "curves": []
        }
    ],
    "materials": []
}