{
    "schema": "lpy",
    "version": "1.1",
    "options": {
        "compilation": {},
        "matching": {},
        "processing": {},
        "interaction": {}
    },
    "parameters": [
        {
            "name": "Panel 1",
            "enabled": true,
            "scalars": [],
            "curves": []
        }
    ],
    "materials": [
        {
            "index": 7,
            "name": "Color_7",
            "ambient": [
                15,
                15,
                15
            ],
            "specular": [
                0,
                0,
                0
            ],
            "emission": [
                0,
                0,
                0
            ],
            "diffuse": 7.0,
            "transparency": 0.0,
            "shininess": 0.2
        }
    ]
}